{
  "authorityClass": "public",
  "dependencyResult": "pass",
  "lifecycleOwner": "spellcraft",
  "mutationHandoff": "ready",
  "ownerBoundaryResult": "pass",
  "packageDigest": "5e42a8df40bd63fe0f4b7d121d4f0705673248fa30d148f96cb813eef7c6743a",
  "packageId": "goal-dfe-swu-dfe-001",
  "patchVerdict": "pass",
  "publicationBoundaryResult": "pass",
  "publicationClass": "public",
  "reasons": [],
  "schemaVersion": "1.0.0",
  "validatedPaths": [
    "spells/goal/development/decision-frontier-experiment/README.md",
    "spells/goal/development/decision-frontier-experiment/fixtures/cycle-map.json",
    "spells/goal/development/decision-frontier-experiment/fixtures/diamond-map.json",
    "spells/goal/development/decision-frontier-experiment/schemas/claim.schema.json",
    "spells/goal/development/decision-frontier-experiment/schemas/decision-map.schema.json",
    "spells/goal/development/decision-frontier-experiment/schemas/frontier-snapshot.schema.json",
    "spells/goal/development/decision-frontier-experiment/schemas/reconciliation.schema.json",
    "spells/goal/development/decision-frontier-experiment/schemas/resolution.schema.json",
    "spells/goal/development/decision-frontier-experiment/schemas/way-clear.schema.json",
    "spells/goal/development/decision-frontier-experiment/scripts/validate_contracts.py"
  ],
  "validationCommands": [
    "python3 goal/development/decision-frontier-experiment/scripts/validate_contracts.py"
  ]
}
