{
  "authorityClass": "public",
  "dependencyResult": "pass",
  "lifecycleOwner": "invoke",
  "mutationHandoff": "ready",
  "ownerBoundaryResult": "pass",
  "packageDigest": "2d83de8cdfaf18071e8cc7f1fc88f13e512e60c5dbf88ca5010cb0da64ee00b8",
  "packageId": "swu-tsgr-005-closeout-sync-v1",
  "patchVerdict": "pass",
  "publicationBoundaryResult": "pass",
  "publicationClass": "public",
  "reasons": [],
  "schemaVersion": "1.0.0",
  "validatedPaths": [
    "arcanum/arcana/task-session/development/invoke-runs/20260730T170810Z-deterministic-governance-runner/CONTINUATION.json",
    "arcanum/arcana/task-session/development/invoke-runs/20260730T170810Z-deterministic-governance-runner/WORK-PACK.md",
    "arcanum/arcana/task-session/development/invoke-runs/20260730T170810Z-deterministic-governance-runner/work-pack/tasks/TASK-TSGR-02-RUNNER.md",
    "arcanum/arcana/task-session/development/invoke-runs/20260730T170810Z-deterministic-governance-runner/work-pack/waves/W1-RUNNER-MECHANISM.md"
  ],
  "validationCommands": [
    "python3 validate-plan-package.py .",
    "python3 -m json.tool CONTINUATION.json"
  ]
}
